{"$schema":"https://json-schema.org/draft/2020-12/schema","title":"Fact","type":"object","properties":{"file":{"type":"string"},"id":{"type":"string"},"kind":{"type":"string"},"payload":{"$ref":"#/$defs/Payload"},"profile":{"type":"string"},"symbol":{"type":"string"}},"additionalProperties":false,"required":["id","symbol","kind","file","profile","payload"],"$defs":{"Field":{"type":"object","properties":{"end":{"type":"integer","format":"uint","minimum":0},"name":{"type":"string"},"start":{"type":"integer","format":"uint","minimum":0}},"additionalProperties":false,"required":["name","start","end"]},"Node":{"type":"object","properties":{"end":{"type":"integer","format":"uint","minimum":0},"fields":{"type":"array","items":{"$ref":"#/$defs/Slot"}},"kind":{"type":"string"},"start":{"type":"integer","format":"uint","minimum":0},"value":{"type":"string"}},"additionalProperties":false,"required":["kind","start","end","value","fields"]},"Payload":{"oneOf":[{"type":"object","properties":{"documentation":{"type":["string","null"]},"documentation_text":{"type":["string","null"]},"end":{"type":"integer","format":"uint","minimum":0},"family":{"type":"string","const":"syntax"},"fields":{"type":"array","items":{"$ref":"#/$defs/Field"}},"name":{"type":["string","null"]},"node_kind":{"type":"string"},"owner":{"type":["string","null"]},"role":{"type":"string"},"signature":{"type":["string","null"]},"source_digest":{"type":"string"},"start":{"type":"integer","format":"uint","minimum":0},"syntax_valid":{"type":"boolean"}},"additionalProperties":false,"required":["family","node_kind","role","start","end","fields","source_digest","syntax_valid"]},{"type":"object","properties":{"binding":{"type":["string","null"]},"end":{"type":"integer","format":"uint","minimum":0},"event":{"type":"string"},"family":{"type":"string","const":"lexical"},"name":{"type":"string"},"resolution":{"type":"string"},"scope":{"type":"string"},"start":{"type":"integer","format":"uint","minimum":0},"target":{"type":["string","null"]},"typing_only":{"type":["boolean","null"]}},"additionalProperties":false,"required":["family","name","event","start","end","scope","resolution"]},{"type":"object","properties":{"end":{"type":"integer","format":"uint","minimum":0},"family":{"type":"string","const":"execution"},"fields":{"type":"array","items":{"$ref":"#/$defs/Slot"}},"kind":{"type":"string"},"start":{"type":"integer","format":"uint","minimum":0},"value":{"type":"string"}},"additionalProperties":false,"required":["family","kind","start","end","value","fields"]},{"type":"object","properties":{"family":{"type":"string","const":"file_state"},"language":{"type":"string"},"lexical_state":{"type":"string"},"parse_state":{"type":"string"},"reason":{"type":["string","null"]}},"additionalProperties":false,"required":["family","language","parse_state","lexical_state"]}]},"Slot":{"type":"object","properties":{"nodes":{"type":"array","items":{"$ref":"#/$defs/Node"}},"role":{"type":"string"}},"additionalProperties":false,"required":["role","nodes"]}}}
