{"file":"pyarrow/dataset.py","id":"syntax:3e499f5547ee680847d223078110a3a1ec62bd9275b3b8641c5824a29b24bea0:4b78383bd1bd2218d6072afbb59e6af07c0c0b7e489e806680ab225f66860987:20886:28731:string","kind":"comment_or_string","payload":{"documentation":"python_docstring","documentation_text":"\"\"\"\n    Open a dataset.\n\n    Datasets provides functionality to efficiently work with tabular,\n    potentially larger than memory and multi-file dataset.\n\n    - A unified interface for different sources, like Parquet and Feather\n    - Discovery of sources (crawling directories, handle directory-based\n      partitioned datasets, basic schema normalization)\n    - Optimized reading with predicate pushdown (filtering rows), projection\n      (selecting columns), parallel reading or fine-grained managing of tasks.\n\n    Note that this is the high-level API, to have more control over the dataset\n    construction use the low-level API classes (FileSystemDataset,\n    FilesystemDatasetFactory, etc.)\n\n    Parameters\n    ----------\n    source : path, list of paths, dataset, list of datasets, (list of) \\\nRecordBatch or Table, iterable of RecordBatch, RecordBatchReader, or URI\n        Path pointing to a single file:\n            Open a FileSystemDataset from a single file.\n        Path pointing to a directory:\n            The directory gets discovered recursively according to a\n            partitioning scheme if given.\n        List of file paths:\n            Create a FileSystemDataset from explicitly given files. The files\n            must be located on the same filesystem given by the filesystem\n            parameter.\n            Note that in contrary of construction from a single file, passing\n            URIs as paths is not allowed.\n        List of datasets:\n            A nested UnionDataset gets constructed, it allows arbitrary\n            composition of other datasets.\n            Note that additional keyword arguments are not allowed.\n        (List of) batches or tables, iterable of batches, or RecordBatchReader:\n            Create an InMemoryDataset. If an iterable or empty list is given,\n            a schema must also be given. If an iterable or RecordBatchReader\n            is given, the resulting dataset can only be scanned once; further\n            attempts will raise an error.\n    schema : Schema, optional\n        Optionally provide the Schema for the Dataset, in which case it will\n        not be inferred from the source.\n    format : FileFormat or str\n        Currently \"parquet\", \"ipc\"/\"arrow\"/\"feather\", \"csv\", \"json\", and \"orc\" are\n        supported. For Feather, only version 2 files are supported.\n    filesystem : FileSystem or URI string, default None\n        If a single path is given as source and filesystem is None, then the\n        filesystem will be inferred from the path.\n        If an URI string is passed, then a filesystem object is constructed\n        using the URI's optional path component as a directory prefix. See the\n        examples below.\n        Note that the URIs on Windows must follow 'file:///C:...' or\n        'file:/C:...' patterns.\n    partitioning : Partitioning, PartitioningFactory, str, list of str\n        The partitioning scheme specified with the ``partitioning()``\n        function. A flavor string can be used as shortcut, and with a list of\n        field names a DirectoryPartitioning will be inferred.\n    partition_base_dir : str, optional\n        For the purposes of applying the partitioning, paths will be\n        stripped of the partition_base_dir. Files not matching the\n        partition_base_dir prefix will be skipped for partitioning discovery.\n        The ignored files will still be part of the Dataset, but will not\n        have partition information.\n    exclude_invalid_files : bool, optional (default False)\n        If True, invalid files will be excluded (file format specific check).\n        This will incur IO for each files in a serial and single threaded\n        fashion. Disabling this feature will skip the IO, but unsupported\n        files may be present in the Dataset (resulting in an error at scan\n        time).\n    ignore_prefixes : list, optional\n        Files matching any of these prefixes will be ignored by the\n        discovery process. This is matched to the basename of a path.\n        By default this is ['.', '_'].\n        Note that discovery happens only if a directory is passed as source.\n\n    Returns\n    -------\n    dataset : Dataset\n        Either a FileSystemDataset or a UnionDataset depending on the source\n        parameter.\n\n    Examples\n    --------\n    Creating an example Table:\n\n    >>> import pyarrow as pa\n    >>> import pyarrow.parquet as pq\n    >>> table = pa.table({'year': [2020, 2022, 2021, 2022, 2019, 2021],\n    ...                   'n_legs': [2, 2, 4, 4, 5, 100],\n    ...                   'animal': [\"Flamingo\", \"Parrot\", \"Dog\", \"Horse\",\n    ...                              \"Brittle stars\", \"Centipede\"]})\n    >>> pq.write_table(table, \"file.parquet\")\n\n    Opening a single file:\n\n    >>> import pyarrow.dataset as ds\n    >>> dataset = ds.dataset(\"file.parquet\", format=\"parquet\")\n    >>> dataset.to_table()\n    pyarrow.Table\n    year: int64\n    n_legs: int64\n    animal: string\n    ----\n    year: [[2020,2022,2021,2022,2019,2021]]\n    n_legs: [[2,2,4,4,5,100]]\n    animal: [[\"Flamingo\",\"Parrot\",\"Dog\",\"Horse\",\"Brittle stars\",\"Centipede\"]]\n\n    Opening a single file with an explicit schema:\n\n    >>> myschema = pa.schema([\n    ...     ('n_legs', pa.int64()),\n    ...     ('animal', pa.string())])\n    >>> dataset = ds.dataset(\"file.parquet\", schema=myschema, format=\"parquet\")\n    >>> dataset.to_table()\n    pyarrow.Table\n    n_legs: int64\n    animal: string\n    ----\n    n_legs: [[2,2,4,4,5,100]]\n    animal: [[\"Flamingo\",\"Parrot\",\"Dog\",\"Horse\",\"Brittle stars\",\"Centipede\"]]\n\n    Opening a dataset for a single directory:\n\n    >>> ds.write_dataset(table, \"partitioned_dataset\", format=\"parquet\",\n    ...                  partitioning=['year'])\n    >>> dataset = ds.dataset(\"partitioned_dataset\", format=\"parquet\")\n    >>> dataset.to_table()\n    pyarrow.Table\n    n_legs: int64\n    animal: string\n    ----\n    n_legs: [[5],[2],[4,100],[2,4]]\n    animal: [[\"Brittle stars\"],[\"Flamingo\"],...[\"Parrot\",\"Horse\"]]\n\n    For a single directory from a S3 bucket:\n\n    >>> ds.dataset(\"s3://mybucket/nyc-taxi/\",\n    ...            format=\"parquet\") # doctest: +SKIP\n\n    Opening a dataset from a list of relatives local paths:\n\n    >>> dataset = ds.dataset([\n    ...     \"partitioned_dataset/2019/part-0.parquet\",\n    ...     \"partitioned_dataset/2020/part-0.parquet\",\n    ...     \"partitioned_dataset/2021/part-0.parquet\",\n    ... ], format='parquet')\n    >>> dataset.to_table()\n    pyarrow.Table\n    n_legs: int64\n    animal: string\n    ----\n    n_legs: [[5],[2],[4,100]]\n    animal: [[\"Brittle stars\"],[\"Flamingo\"],[\"Dog\",\"Centipede\"]]\n\n    With filesystem provided:\n\n    >>> paths = [\n    ...     'part0/data.parquet',\n    ...     'part1/data.parquet',\n    ...     'part3/data.parquet',\n    ... ]\n    >>> ds.dataset(paths, filesystem='file:///directory/prefix,\n    ...            format='parquet') # doctest: +SKIP\n\n    Which is equivalent with:\n\n    >>> fs = SubTreeFileSystem(\"/directory/prefix\",\n    ...                        LocalFileSystem()) # doctest: +SKIP\n    >>> ds.dataset(paths, filesystem=fs, format='parquet') # doctest: +SKIP\n\n    With a remote filesystem URI:\n\n    >>> paths = [\n    ...     'nested/directory/part0/data.parquet',\n    ...     'nested/directory/part1/data.parquet',\n    ...     'nested/directory/part3/data.parquet',\n    ... ]\n    >>> ds.dataset(paths, filesystem='s3://bucket/',\n    ...            format='parquet') # doctest: +SKIP\n\n    Similarly to the local example, the directory prefix may be included in the\n    filesystem URI:\n\n    >>> ds.dataset(paths, filesystem='s3://bucket/nested/directory',\n    ...         format='parquet') # doctest: +SKIP\n\n    Construction of a nested dataset:\n\n    >>> ds.dataset([\n    ...     dataset(\"s3://old-taxi-data\", format=\"parquet\"),\n    ...     dataset(\"local/path/to/data\", format=\"ipc\")\n    ... ]) # doctest: +SKIP\n    \"\"\"","end":28731,"family":"syntax","fields":[],"name":null,"node_kind":"string","owner":"syntax:3e499f5547ee680847d223078110a3a1ec62bd9275b3b8641c5824a29b24bea0:4b78383bd1bd2218d6072afbb59e6af07c0c0b7e489e806680ab225f66860987:20700:30357:function_definition","role":"comment_or_string","signature":null,"source_digest":"4b78383bd1bd2218d6072afbb59e6af07c0c0b7e489e806680ab225f66860987","start":20886,"syntax_valid":true},"profile":"python-installed-54-25","symbol":"pyarrow/dataset.py"}