{"file":"datafusion/dataframe.py","id":"syntax:2a83981f731246e2038739a9c9abb71e7d6c3d594b61f645feca79688de32b84:1c1a28f2cf25fec6d5032d1b446684b1f3e444275b87d4615e6f7e4b36930ff4:37110:37475:string","kind":"comment_or_string","payload":{"documentation":"python_docstring","documentation_text":"\"\"\"Execute this :py:class:`DataFrame` and collect results into memory.\n\n        Prior to calling ``collect``, modifying a DataFrame simply updates a plan\n        (no actual computation is performed). Calling ``collect`` triggers the\n        computation.\n\n        Returns:\n            List of :py:class:`pyarrow.RecordBatch` collected from the DataFrame.\n        \"\"\"","end":37475,"family":"syntax","fields":[],"name":null,"node_kind":"string","owner":"syntax:2a83981f731246e2038739a9c9abb71e7d6c3d594b61f645feca79688de32b84:1c1a28f2cf25fec6d5032d1b446684b1f3e444275b87d4615e6f7e4b36930ff4:37059:37508:function_definition","role":"comment_or_string","signature":null,"source_digest":"1c1a28f2cf25fec6d5032d1b446684b1f3e444275b87d4615e6f7e4b36930ff4","start":37110,"syntax_valid":true},"profile":"python-installed-54-25","symbol":"datafusion/dataframe.py"}