{"file":"datafusion/dataframe.py","id":"syntax:2a83981f731246e2038739a9c9abb71e7d6c3d594b61f645feca79688de32b84:1c1a28f2cf25fec6d5032d1b446684b1f3e444275b87d4615e6f7e4b36930ff4:37059:37508:function_definition","kind":"definition","payload":{"documentation":null,"documentation_text":null,"end":37508,"family":"syntax","fields":[{"end":37070,"name":"name","start":37063},{"end":37076,"name":"parameters","start":37070},{"end":37100,"name":"return_type","start":37080},{"end":37508,"name":"body","start":37110}],"name":"collect","node_kind":"function_definition","owner":"syntax:2a83981f731246e2038739a9c9abb71e7d6c3d594b61f645feca79688de32b84:1c1a28f2cf25fec6d5032d1b446684b1f3e444275b87d4615e6f7e4b36930ff4:15305:71376:class_definition","role":"definition","signature":"def collect(self) -> list[pa.RecordBatch]:","source_digest":"1c1a28f2cf25fec6d5032d1b446684b1f3e444275b87d4615e6f7e4b36930ff4","start":37059,"syntax_valid":true},"profile":"python-installed-54-25","symbol":"collect"}