{"file":"datafusion/dataframe.py","id":"syntax:2a83981f731246e2038739a9c9abb71e7d6c3d594b61f645feca79688de32b84:1c1a28f2cf25fec6d5032d1b446684b1f3e444275b87d4615e6f7e4b36930ff4:63641:63914:function_definition","kind":"definition","payload":{"documentation":null,"documentation_text":null,"end":63914,"family":"syntax","fields":[{"end":63659,"name":"name","start":63645},{"end":63665,"name":"parameters","start":63659},{"end":63686,"name":"return_type","start":63669},{"end":63914,"name":"body","start":63696}],"name":"execute_stream","node_kind":"function_definition","owner":"syntax:2a83981f731246e2038739a9c9abb71e7d6c3d594b61f645feca79688de32b84:1c1a28f2cf25fec6d5032d1b446684b1f3e444275b87d4615e6f7e4b36930ff4:15305:71376:class_definition","role":"definition","signature":"def execute_stream(self) -> RecordBatchStream:","source_digest":"1c1a28f2cf25fec6d5032d1b446684b1f3e444275b87d4615e6f7e4b36930ff4","start":63641,"syntax_valid":true},"profile":"python-installed-54-25","symbol":"execute_stream"}