{"file":"pyarrow/dataset.py","id":"syntax:3e499f5547ee680847d223078110a3a1ec62bd9275b3b8641c5824a29b24bea0:4b78383bd1bd2218d6072afbb59e6af07c0c0b7e489e806680ab225f66860987:20700:30357:function_definition","kind":"definition","payload":{"documentation":null,"documentation_text":null,"end":30357,"family":"syntax","fields":[{"end":20711,"name":"name","start":20704},{"end":20880,"name":"parameters","start":20711},{"end":30357,"name":"body","start":20886}],"name":"dataset","node_kind":"function_definition","owner":null,"role":"definition","signature":"def dataset(source, schema=None, format=None, filesystem=None,\n            partitioning=None, partition_base_dir=None,\n            exclude_invalid_files=None, ignore_prefixes=None):","source_digest":"4b78383bd1bd2218d6072afbb59e6af07c0c0b7e489e806680ab225f66860987","start":20700,"syntax_valid":true},"profile":"python-installed-54-25","symbol":"dataset"}